{
  "name":"METACLOUD-CentOS-7.3-1704-x86_64@metacloud-dukan",
  "url":"http://cloud.centos.org/centos/7/images/CentOS-7-x86_64-GenericCloud-1704.qcow2",
  "verification":{
    "signature":{
      "clearsign":{
        "file":"http://cloud.centos.org/centos/7/images/sha256sum.txt.asc"
      }
    },
    "hash":{
      "function":"SHA256"
    }
  },
  "distribution":"CentOS",
  "version":"7.3-1704",
  "actions":{
    "copy":[
      {
        "source":"centos-cloud.cfg",
        "target":"/etc/cloud/",
        "name":"cloud.cfg"
      },
      {
        "source":"serial-getty@ttyS0.service",
        "target":"/etc/systemd/system/getty.target.wants/"
      }
    ]
  }
}
